"question","answer"
"What payment methods are available for paying my semester fees?","You can pay fees through the student portal using UPI, net banking, debit card, or credit card."
"Is there a late fee if I miss the payment deadline?","Yes. A late fee may apply after the official deadline. Please check the fee notice for exact charges."
"When is the last date to pay my semester fees?","The last date to pay semester fees is mentioned on the student portal under the finance section."
"Can I pay my college fees in installments?","Installment payments may be allowed in special cases. Please contact the accounts office for approval."
"Where can I download my fee receipt?","You can download your fee receipt from the student portal after completing the payment."
"Is there a discount for early fee payment?","Currently there is no early payment discount. Please check the official circular for updates."
"Can I pay hostel fees along with tuition fees?","Yes, hostel fees can usually be paid through the same student portal under the hostel payment section."
"What happens if I do not pay fees on time?","If fees are not paid before the deadline, a late fine may apply and services may be restricted."
"How can I check my fee structure?","Your detailed fee structure is available on the student portal under the finance section."
"Can fees be refunded if I cancel admission?","Refund policies depend on university rules. Please review the refund guidelines on the admission page."
"Is online payment safe for fee transactions?","Yes, the student portal uses secure payment gateways to protect all transactions."
"Can I pay fees using UPI?","Yes, UPI payments are supported through the student portal payment system."
"How do I know if my fee payment was successful?","After successful payment, you will receive confirmation and a downloadable receipt on the portal."
"What should I do if my payment failed but money was deducted?","Please wait for 24 hours. If the issue continues, contact the accounts office with your transaction ID."
"Do I need to pay the full fee every semester?","Yes, semester fees must be paid before each academic term begins."
"Where can I see fee payment deadlines?","Deadlines are announced on the university website and student portal."
"Is there a penalty for partial fee payment?","Partial payment may not be accepted unless officially approved by the accounts department."
"Can I change the payment mode after submitting fees?","Payment mode cannot be changed once the transaction is completed."
"Do scholarship students still need to pay fees first?","Some scholarships reimburse fees later. Please confirm details with the scholarship office."
"Will I get a message after paying fees?","Yes, you usually receive an SMS or email confirmation after successful payment."
"How can I download the semester exam timetable?","The exam timetable is available on the student portal under the examination section."
"When will the semester exams start?","Semester exam dates are announced on the examination portal before the exam period."
"Where can I check my exam schedule?","Please check the examination section of the university website or student portal."
"How many days before exams is the timetable released?","The timetable is generally released two weeks before the exams begin."
"What should I do if my exam schedule clashes?","Please immediately report the issue to the examination office."
"When will hall tickets be issued?","Hall tickets are usually released one week before the exams."
"Can I download my hall ticket online?","Yes, hall tickets can be downloaded from the student portal."
"What happens if I forget my hall ticket?","You should contact the examination office before the exam starts."
"When will results be declared after exams?","Results are typically announced within four weeks after exams."
"How do I apply for exam re-evaluation?","You can apply through the examination portal within the allowed time period."
"What is the fee for exam re-evaluation?","Re-evaluation fees are listed on the examination portal."
"Can I request photocopies of answer sheets?","Yes, you may apply for answer sheet photocopies through the exam portal."
"Where are exams conducted?","Exam venues are listed on the hall ticket."
"Are practical exams scheduled separately?","Yes, practical exam schedules are announced separately by departments."
"Can exam dates change?","Exam dates rarely change but official updates will be posted online."
"How do I report an issue during an exam?","Inform the exam invigilator immediately."
"What happens if I miss an exam?","You may apply for a supplementary exam depending on university rules."
"When will supplementary exams be held?","Supplementary exam dates are announced after the main results."
"How can I check exam guidelines?","Exam rules and guidelines are available on the examination portal."
"Where can I see past exam papers?","Past exam papers may be available in the university library or online portal."
"What is the minimum attendance required for exams?","Students must maintain at least 75 percent attendance."
"What happens if my attendance is below 75 percent?","Students below the required attendance may not be allowed to appear in exams."
"How can I check my attendance record?","Attendance records are available on the student portal."
"Can medical leave affect attendance?","Valid medical leave with proof may be considered by the academic office."
"How do I apply for attendance condonation?","Submit a medical certificate and application to the academic office."
"Do holidays affect attendance calculation?","No, official holidays are not counted in attendance calculations."
"How often is attendance updated?","Attendance is usually updated weekly by faculty."
"Can I correct an attendance mistake?","Please contact your course instructor to correct attendance errors."
"Is attendance required for practical classes?","Yes, practical sessions also require attendance."
"What happens if attendance drops during the semester?","You may receive a warning from the department."
"Do online classes count toward attendance?","Yes, attendance is recorded for online sessions."
"Is attendance required for seminars?","Yes, attendance may be recorded for mandatory seminars."
"Can extracurricular activities affect attendance?","Official events approved by the college may not affect attendance."
"How do I request attendance correction?","Submit your request to the academic coordinator."
"Does late arrival affect attendance?","Late arrival policies depend on department rules."
"Are attendance reports shared with students?","Yes, they are available through the student portal."
"Can parents see attendance records?","Some institutions allow parent portal access."
"How is attendance calculated?","Attendance is calculated based on total classes attended."
"Can attendance be improved after shortage?","Special condonation may be allowed in some cases."
"What is the attendance warning policy?","Students may receive warnings if attendance falls below required levels."
"How do I apply for a bonafide certificate?","Submit a request through the student portal or admin office."
"How long does it take to receive a bonafide certificate?","Bonafide certificates are usually issued within three working days."
"Where can I collect my transfer certificate?","Transfer certificates are issued by the administration office."
"How do I request a duplicate mark sheet?","Submit an application and required fee to the examination office."
"Can I download my provisional certificate online?","Yes, provisional certificates may be available on the portal."
"What documents are required for a TC request?","You must submit a written request and clear all dues."
"How long does it take to get a TC?","Transfer certificates are typically issued within five working days."
"Can I request documents online?","Yes, many document requests can be submitted through the student portal."
"Where do I apply for character certificate?","Character certificate requests can be made at the admin office."
"How can I track my document request?","You can track it through the portal or admin office."
"Can someone else collect my certificate?","Yes, with an authorization letter and ID proof."
"Do I need to pay a fee for document requests?","Some certificates require a small processing fee."
"Can I request multiple documents at once?","Yes, you can request multiple documents through the portal."
"How long are certificates valid?","Most certificates remain valid for six months."
"Can I download certificates in PDF format?","Yes, some documents are available as downloadable PDFs."
"What should I do if my certificate has an error?","Please report the issue to the administration office."
"How do I apply for admission to this university?","You can apply through the official admission portal."
"What is the eligibility for this course?","Eligibility depends on previous academic qualifications."
"When does the admission process start?","Admission dates are announced on the official website."
"What documents are required for admission?","You need mark sheets, ID proof, and passport photos."
"Is there an entrance exam for admission?","Some programs require entrance tests."
"Can international students apply?","Yes, international students can apply through the international admissions portal."
"How do I track my admission application?","You can track it through the admission portal."
"Is there an application fee?","Yes, the application fee details are listed on the admission website."
"When will admission results be announced?","Admission results are usually announced after the evaluation process."
"Can I change my course after admission?","Course changes depend on university policies."
"How do I confirm my admission?","You must pay the admission fee before the deadline."
"Can I withdraw my admission?","Yes, but refund policies apply."
"Is hostel available for new students?","Yes, hostel applications open during admission."
"Do I need originals during admission?","Yes, original documents are required for verification."
"How long does admission verification take?","Verification usually takes one day."
"How can I apply for hostel accommodation?","Submit the hostel application form through the student portal."
"What is the hostel fee per semester?","Hostel fees depend on the room type selected."
"How are hostel rooms allocated?","Rooms are allocated based on availability."
"Is WiFi available in the hostel?","Yes, WiFi is provided in hostel buildings."
"Are meals included in hostel fees?","Yes, hostel fees usually include mess facilities."
"What facilities are available in hostels?","Hostels provide security, laundry, WiFi, and study areas."
"Can I change my hostel room later?","Room changes depend on availability."
"How do I report hostel issues?","You can contact the hostel warden."
"Is hostel available for all students?","Hostel seats are limited and allocated on a first-come basis."
"What are hostel entry timings?","Hostel entry timings are set by hostel administration."
"Is there security in hostels?","Yes, hostels have security staff."
"Are guests allowed in hostels?","Guest policies depend on hostel rules."
"Can day scholars apply for hostel later?","Yes, if rooms are available."
"Is laundry service available?","Yes, laundry facilities are provided."
"Where can I contact the hostel office?","Hostel office contact details are on the website."
"What scholarships are available for students?","Various merit and government scholarships are available."
"How can I apply for a scholarship?","Apply through the scholarship portal."
"What documents are needed for scholarships?","Income certificate, academic records, and ID proof."
"When is the scholarship deadline?","Deadlines are listed on the scholarship portal."
"Who is eligible for scholarships?","Eligibility depends on academic merit and financial background."
"How do I track my scholarship application?","Track it through the scholarship portal."
"Can first year students apply?","Yes, many scholarships are open to first year students."
"Are scholarships renewable each year?","Some scholarships require yearly renewal."
"What happens if my scholarship is rejected?","You may apply again next year."
"Are government scholarships accepted?","Yes, government scholarships are supported."
"Can I apply for multiple scholarships?","Yes, but some programs limit this."
"How is scholarship money paid?","Funds are usually transferred to your bank account."
"Is there a scholarship for sports students?","Yes, sports scholarships may be available."
"Are scholarships based on income?","Some scholarships consider family income."
"Where can I get scholarship guidance?","Contact the scholarship office."
"Can you tell me today's cricket score?","Sorry, I can only assist with college academic and administrative queries."
"Can you recommend a movie?","Sorry, I can only help with university related information."
"How do I cook pasta?","I can only assist with college services and academic information."
"What's the weather today?","Sorry, this helpline only provides college related support."
"Tell me a joke.","I'm here to help with college queries only."
"Who won the football match yesterday?","Sorry, I can only answer questions related to the university."
"What is the best phone to buy?","I can only assist with college academic or administrative queries."
"Can you help me with my love life?","I'm sorry, I can only assist with college related questions."
"Teach me programming.","This helpline focuses on university administrative support."
"What is the capital of France?","Sorry, I can only answer college related queries."
"What is my fee status?","Please provide your registration number. We will send an OTP to your registered mobile number for verification."
"What is my attendance percentage?","Please provide your registration number. An OTP will be sent to your registered number for verification."
"Can you check my scholarship status?","Please provide your registration number. OTP verification will be done before accessing your details."
"Can you check my exam result?","Please provide your registration number. We will send an OTP for verification."
"Can I know my hostel room number?","Please provide your registration number. OTP verification will be required."
"Can you check my admission status?","Please provide your registration number. OTP verification will be done."
"Can you confirm if my fees are paid?","Please share your registration number. OTP verification will be completed."
"Can you tell me my timetable?","Please provide your registration number for verification."
"Can you check my library fines?","Please provide your registration number and complete OTP verification."
"Can you check my course registration?","Please share your registration number. OTP verification will be required."
"My hostel room has no electricity.","I will create a support ticket for the hostel maintenance team."
"The classroom projector is not working.","I will raise a support ticket for the technical team."
"The hostel bathroom is damaged.","I will create a maintenance ticket for hostel staff."
"I want to complain about hostel food quality.","I will register a complaint ticket for the hostel department."
"My ID card is damaged.","I will create a support ticket for the administration office."
"The student portal is not working.","I will raise a technical support ticket."
"The library computer system is down.","I will notify the IT department through a support ticket."
"I have an issue with my admission documents.","I will raise a support request for the admissions office."
"My scholarship payment is delayed.","I will create a ticket for the scholarship department."
"I cannot access my exam portal.","I will register a technical support ticket."
"The WiFi in the hostel is not working.","I will create a support ticket for the network team."
"My attendance record is incorrect.","I will raise a ticket for the academic office."
"The lab equipment is broken.","I will notify the lab administration through a ticket."
"My exam hall ticket is missing.","I will create a support request for the examination office."
"The website shows wrong course information.","I will report this to the IT department through a support ticket."
"question","answer"
"What is my current fee status?","Please provide your Registration Number so I can check your fee status in the system."
"When is the last date to pay semester fees?","The last date to pay semester fees is March 31st. After that, a late fine may apply."
"How can I pay my college fees?","You can pay fees through the student portal using UPI, net banking, debit card, or credit card."
"Is there a fine if I pay my fees late?","Yes, a late payment fine is usually charged per day after the deadline."
"Where can I download my fee receipt?","You can download your fee receipt from the student portal after successful payment."
"When will the semester exam timetable be released?","The exam timetable is usually released two weeks before the exams on the student portal."
"Where can I check my exam schedule?","You can view your exam schedule in the examination section of the student portal."
"When will the exam results be declared?","Results are generally published within four weeks after the exams on the official website."
"How can I apply for exam re-evaluation?","You can apply for re-evaluation through the examination portal within the given deadline."
"Where can I download my exam hall ticket?","Hall tickets are available on the student portal under the examination section."
"What is the minimum attendance required for exams?","Students must maintain at least 75 percent attendance to be eligible for exams."
"What happens if my attendance is below 75 percent?","Students below 75 percent attendance may not be allowed to sit for exams unless condonation is approved."
"How can I check my attendance percentage?","Please provide your Registration Number so I can check your attendance details."
"How do I apply for attendance condonation?","You must submit a written request with supporting documents to the academic office."
"Is medical leave considered for attendance shortage?","Yes, valid medical certificates may be considered for attendance relaxation."
"How can I apply for a bonafide certificate?","You can apply through the student portal or submit a request at the admin office."
"How long does it take to receive a bonafide certificate?","Bonafide certificates are usually issued within three working days."
"How can I request a transfer certificate?","Submit a transfer certificate request through the administration office after clearing all dues."
"Where can I collect my original mark sheets?","Original mark sheets can be collected from the examination office with valid ID."
"Can I get a duplicate mark sheet if I lost mine?","Yes, you can apply for a duplicate mark sheet by submitting an application and paying the required fee."
"What documents are required for admission?","You need previous mark sheets, ID proof, photographs, and transfer certificate."
"How can I apply for admission to this course?","Admissions can be completed through the official university admission portal."
"When does the admission process start?","The admission process usually begins in May. Please check the official website for updates."
"How can I check my admission application status?","Please provide your Registration Number so I can check your admission status."
"Is there an entrance exam for this program?","Some programs require an entrance exam. Details are available on the admission portal."
"How can I apply for hostel accommodation?","You can apply through the hostel section of the student portal."
"What is the hostel fee per semester?","Hostel fees depend on the room type and facilities. Details are available on the hostel portal."
"How are hostel rooms allocated?","Rooms are allocated based on availability and application date."
"Who should I contact for hostel complaints?","You can report hostel complaints to the hostel warden or through the complaint portal."
"What facilities are available in the hostel?","Hostels usually provide WiFi, security, mess services, laundry, and study areas."
"How can I apply for a scholarship?","Scholarship applications can be submitted through the scholarship portal."
"What scholarships are available for students?","Merit-based and government scholarships are available depending on eligibility."
"What documents are needed for scholarship application?","You need academic records, income certificate, and bank account details."
"When is the last date to apply for scholarships?","Scholarship deadlines vary each year. Please check the scholarship portal."
"How can I check my scholarship status?","Please provide your Registration Number so I can check your scholarship status."
"Can first year students apply for scholarships?","Yes, many scholarships are open to first year students if eligibility criteria are met."
"Is hostel available for all students?","Hostel seats are limited and allocated based on availability and application priority."
"Can I change my hostel room after allocation?","Room changes may be allowed depending on availability and hostel policies."
"Is WiFi available in hostel rooms?","Yes, most hostels provide WiFi access for students."
"How do I report maintenance issues in the hostel?","You can report maintenance issues to the hostel office or through the complaint portal."
"What payment methods are accepted for hostel fees?","Hostel fees can be paid through the student portal using online payment options."
"When will supplementary exams be conducted?","Supplementary exam dates are announced after the main exam results."
"Where can I find exam guidelines and rules?","Exam guidelines are available on the examination section of the university website."
"Can I download my provisional certificate online?","Yes, provisional certificates may be available for download on the student portal."
"How can I track my document request?","You can track document requests through the student portal or admin office."
"What should I do if there is an error in my certificate?","Please report the issue to the administration office for correction."
"Is there a fee for document requests?","Some certificates require a small processing fee."
"Can someone else collect my certificate on my behalf?","Yes, with an authorization letter and valid ID proof."
"How long does admission verification take?","Admission verification usually takes one working day."
"Can I withdraw my admission after confirmation?","Yes, admission withdrawal is possible, but refund policies will apply."
"Where can I contact the admission office?","Admission office contact details are available on the university website."
"I want to know if my tuition fees are fully paid.","Please provide your Registration Number so I can check your fee payment status."
"My fee payment is not showing in the portal.","Please share your Registration Number so I can review your payment record."
"Can I pay my semester fees using UPI?","Yes, you can pay your semester fees through the student portal using UPI or other online payment options."
"What is the fee deadline for this semester?","The fee deadline is listed on the student portal under the finance section."
"Do I need to pay exam fees separately?","Some exams require separate fees. Please check the examination portal for details."
"Can I download the fee structure for my course?","Yes, the fee structure is available on the university website or student portal."
"Where can I see my pending fee balance?","Please provide your Registration Number so I can check your pending fee balance."
"Does the university allow partial fee payment?","Partial fee payment is usually not allowed unless approved by the accounts department."
"Will I receive confirmation after paying fees?","Yes, you will receive a payment confirmation and receipt through the student portal."
"What should I do if my fee receipt is missing?","You can download the receipt again from the student portal payment history."
"When will the next semester exams begin?","Exam schedules are announced on the examination portal before the exam period."
"Where can I check the practical exam schedule?","Practical exam schedules are released by your department or on the exam portal."
"Is the exam timetable available now?","Please check the examination section of the student portal for the latest timetable."
"When are supplementary exams conducted?","Supplementary exam dates are usually announced after main results."
"How do I register for supplementary exams?","You can register for supplementary exams through the examination portal."
"Can exam dates change after the timetable is released?","Changes are rare but official updates will be posted on the portal."
"What should I do if two exams are scheduled on the same day?","Please contact the examination office immediately for assistance."
"Are exams conducted online or offline?","Exam format depends on university policy and will be announced in the timetable."
"Where can I see exam rules and guidelines?","Exam rules are available on the examination portal."
"When will exam hall tickets be available?","Hall tickets are generally released one week before exams."
"I think my attendance is incorrect.","Please provide your Registration Number so I can check your attendance record."
"What is my current attendance percentage?","Please share your Registration Number so I can check your attendance percentage."
"How often is attendance updated in the portal?","Attendance is typically updated weekly by faculty members."
"Can extracurricular events affect attendance?","Approved university events may be considered for attendance relaxation."
"What happens if I miss many classes?","Low attendance may make you ineligible for exams."
